TambonID,PostCode,TambonThaiShort,DistrictThaiShort,ProvinceThai,Region
101301,10100,จักรวรรดิ,สัมพันธวงศ์,กรุงเทพมหานคร,ภาคกลาง
100804,10100,บ้านบาตร,ป้อมปราบศัตรูพ่าย,กรุงเทพมหานคร,ภาคกลาง
100801,10100,ป้อมปราบ,ป้อมปราบศัตรูพ่าย,กรุงเทพมหานคร,ภาคกลาง
101303,10100,ตลาดน้อย,สัมพันธวงศ์,กรุงเทพมหานคร,ภาคกลาง
100802,10100,วัดเทพศิรินทร์,ป้อมปราบศัตรูพ่าย,กรุงเทพมหานคร,ภาคกลาง
101302,10100,สัมพันธวงศ์,สัมพันธวงศ์,กรุงเทพมหานคร,ภาคกลาง
100803,10100,คลองมหานาค,ป้อมปราบศัตรูพ่าย,กรุงเทพมหานคร,ภาคกลาง
100805,10100,วัดโสมนัส,ป้อมปราบศัตรูพ่าย,กรุงเทพมหานคร,ภาคกลาง
103302,10110,คลองตัน,คลองเตย,กรุงเทพมหานคร,ภาคกลาง
103902,10110,คลองตันเหนือ,วัฒนา,กรุงเทพมหานคร,ภาคกลาง
103301,10110,คลองเตย,คลองเตย,กรุงเทพมหานคร,ภาคกลาง
103901,10110,คลองเตยเหนือ,วัฒนา,กรุงเทพมหานคร,ภาคกลาง
103303,10110,พระโขนง,คลองเตย,กรุงเทพมหานคร,ภาคกลาง
100702,10110,วังใหม่,ปทุมวัน,กรุงเทพมหานคร,ภาคกลาง
103903,10110,พระโขนงเหนือ,วัฒนา,กรุงเทพมหานคร,ภาคกลาง
101203,10120,ช่องนนทรี,ยานนาวา,กรุงเทพมหานคร,ภาคกลาง
101204,10120,บางโพงพาง,ยานนาวา,กรุงเทพมหานคร,ภาคกลาง
103103,10120,บางโคล่,บางคอแหลม,กรุงเทพมหานคร,ภาคกลาง
102801,10120,ทุ่งวัดดอน,สาทร,กรุงเทพมหานคร,ภาคกลาง
102802,10120,ยานนาวา,สาทร,กรุงเทพมหานคร,ภาคกลาง
102803,10120,ทุ่งมหาเมฆ,สาทร,กรุงเทพมหานคร,ภาคกลาง
103101,10120,บางคอแหลม,บางคอแหลม,กรุงเทพมหานคร,ภาคกลาง
103102,10120,วัดพระยาไกร,บางคอแหลม,กรุงเทพมหานคร,ภาคกลาง
100702,10120,วังใหม่,ปทุมวัน,กรุงเทพมหานคร,ภาคกลาง
110406,10130,บางหัวเสือ,พระประแดง,สมุทรปราการ,ภาคกลาง
110414,10130,สำโรง,พระประแดง,สมุทรปราการ,ภาคกลาง
110413,10130,ทรงคนอง,พระประแดง,สมุทรปราการ,ภาคกลาง
110402,10130,บางพึ่ง,พระประแดง,สมุทรปราการ,ภาคกลาง
110412,10130,บางกอบัว,พระประแดง,สมุทรปราการ,ภาคกลาง
110404,10130,บางครุ,พระประแดง,สมุทรปราการ,ภาคกลาง
110411,10130,บางกระสอบ,พระประแดง,สมุทรปราการ,ภาคกลาง
110407,10130,สำโรงใต้,พระประแดง,สมุทรปราการ,ภาคกลาง
110410,10130,บางน้ำผึ้ง,พระประแดง,สมุทรปราการ,ภาคกลาง
110409,10130,บางกะเจ้า,พระประแดง,สมุทรปราการ,ภาคกลาง
110408,10130,บางยอ,พระประแดง,สมุทรปราการ,ภาคกลาง
110403,10130,บางจาก,พระประแดง,สมุทรปราการ,ภาคกลาง
110405,10130,บางหญ้าแพรก,พระประแดง,สมุทรปราการ,ภาคกลาง
110401,10130,ตลาด,พระประแดง,สมุทรปราการ,ภาคกลาง
110415,10130,สำโรงกลาง,พระประแดง,สมุทรปราการ,ภาคกลาง
102401,10140,ราษฎร์บูรณะ,ราษฎร์บูรณะ,กรุงเทพมหานคร,ภาคกลาง
102402,10140,บางปะกอก,ราษฎร์บูรณะ,กรุงเทพมหานคร,ภาคกลาง
104902,10140,ทุ่งครุ,ทุ่งครุ,กรุงเทพมหานคร,ภาคกลาง
104901,10140,บางมด,ทุ่งครุ,กรุงเทพมหานคร,ภาคกลาง
102107,10150,แสมดำ,บางขุนเทียน,กรุงเทพมหานคร,ภาคกลาง
105005,10150,คลองบางบอน,บางบอน,กรุงเทพมหานคร,ภาคกลาง
105004,10150,คลองบางพราน,บางบอน,กรุงเทพมหานคร,ภาคกลาง
105003,10150,บางบอนใต้,บางบอน,กรุงเทพมหานคร,ภาคกลาง
103504,10150,จอมทอง,จอมทอง,กรุงเทพมหานคร,ภาคกลาง
105002,10150,บางบอนเหนือ,บางบอน,กรุงเทพมหานคร,ภาคกลาง
103503,10150,บางมด,จอมทอง,กรุงเทพมหานคร,ภาคกลาง
103502,10150,บางค้อ,จอมทอง,กรุงเทพมหานคร,ภาคกลาง
103501,10150,บางขุนเทียน,จอมทอง,กรุงเทพมหานคร,ภาคกลาง
102105,10150,ท่าข้าม,บางขุนเทียน,กรุงเทพมหานคร,ภาคกลาง
102209,10160,ปากคลองภาษีเจริญ,ภาษีเจริญ,กรุงเทพมหานคร,ภาคกลาง
102201,10160,บางหว้า,ภาษีเจริญ,กรุงเทพมหานคร,ภาคกลาง
104004,10160,หลักสอง,บางแค,กรุงเทพมหานคร,ภาคกลาง
104003,10160,บางไผ่,บางแค,กรุงเทพมหานคร,ภาคกลาง
104002,10160,บางแคเหนือ,บางแค,กรุงเทพมหานคร,ภาคกลาง
104001,10160,บางแค,บางแค,กรุงเทพมหานคร,ภาคกลาง
102208,10160,คลองขวาง,ภาษีเจริญ,กรุงเทพมหานคร,ภาคกลาง
102202,10160,บางด้วน,ภาษีเจริญ,กรุงเทพมหานคร,ภาคกลาง
102302,10160,หนองแขม,หนองแขม,กรุงเทพมหานคร,ภาคกลาง
102206,10160,บางจาก,ภาษีเจริญ,กรุงเทพมหานคร,ภาคกลาง
102303,10160,หนองค้างพลู,หนองแขม,กรุงเทพมหานคร,ภาคกลาง
102207,10160,บางแวก,ภาษีเจริญ,กรุงเทพมหานคร,ภาคกลาง
102210,10160,คูหาสวรรค์,ภาษีเจริญ,กรุงเทพมหานคร,ภาคกลาง
104802,10170,ศาลาธรรมสพน์,ทวีวัฒนา,กรุงเทพมหานคร,ภาคกลาง
101905,10170,บางระมาด,ตลิ่งชัน,กรุงเทพมหานคร,ภาคกลาง
104801,10170,ทวีวัฒนา,ทวีวัฒนา,กรุงเทพมหานคร,ภาคกลาง
101907,10170,บางเชือกหนัง,ตลิ่งชัน,กรุงเทพมหานคร,ภาคกลาง
101902,10170,ตลิ่งชัน,ตลิ่งชัน,กรุงเทพมหานคร,ภาคกลาง
101901,10170,คลองชักพระ,ตลิ่งชัน,กรุงเทพมหานคร,ภาคกลาง
101903,10170,ฉิมพลี,ตลิ่งชัน,กรุงเทพมหานคร,ภาคกลาง
101904,10170,บางพรม,ตลิ่งชัน,กรุงเทพมหานคร,ภาคกลาง
100101,10200,พระบรมมหาราชวัง,พระนคร,กรุงเทพมหานคร,ภาคกลาง
100108,10200,ตลาดยอด,พระนคร,กรุงเทพมหานคร,ภาคกลาง
100107,10200,บวรนิเวศ,พระนคร,กรุงเทพมหานคร,ภาคกลาง
100106,10200,เสาชิงช้า,พระนคร,กรุงเทพมหานคร,ภาคกลาง
100105,10200,ศาลเจ้าพ่อเสือ,พระนคร,กรุงเทพมหานคร,ภาคกลาง
100111,10200,บางขุนพรหม,พระนคร,กรุงเทพมหานคร,ภาคกลาง
100112,10200,วัดสามพระยา,พระนคร,กรุงเทพมหานคร,ภาคกลาง
100104,10200,สำราญราษฎร์,พระนคร,กรุงเทพมหานคร,ภาคกลาง
100110,10200,บ้านพานถม,พระนคร,กรุงเทพมหานคร,ภาคกลาง
100109,10200,ชนะสงคราม,พระนคร,กรุงเทพมหานคร,ภาคกลาง
100103,10200,วัดราชบพิธ,พระนคร,กรุงเทพมหานคร,ภาคกลาง
100102,10200,วังบูรพาภิรมย์,พระนคร,กรุงเทพมหานคร,ภาคกลาง
103602,10210,สีกัน,ดอนเมือง,กรุงเทพมหานคร,ภาคกลาง
103605,10210,สนามบิน,ดอนเมือง,กรุงเทพมหานคร,ภาคกลาง
104101,10210,ทุ่งสองห้อง,หลักสี่,กรุงเทพมหานคร,ภาคกลาง
104102,10210,ตลาดบางเขน,หลักสี่,กรุงเทพมหานคร,ภาคกลาง
103604,10210,ดอนเมือง,ดอนเมือง,กรุงเทพมหานคร,ภาคกลาง
104203,10220,คลองถนน,สายไหม,กรุงเทพมหานคร,ภาคกลาง
104202,10220,ออเงิน,สายไหม,กรุงเทพมหานคร,ภาคกลาง
100502,10220,อนุสาวรีย์,บางเขน,กรุงเทพมหานคร,ภาคกลาง
104201,10220,สายไหม,สายไหม,กรุงเทพมหานคร,ภาคกลาง
100508,10220,ท่าแร้ง,บางเขน,กรุงเทพมหานคร,ภาคกลาง
104302,10230,รามอินทรา,คันนายาว,กรุงเทพมหานคร,ภาคกลาง
104301,10230,คันนายาว,คันนายาว,กรุงเทพมหานคร,ภาคกลาง
102705,10230,นวลจันทร์,บึงกุ่ม,กรุงเทพมหานคร,ภาคกลาง
103802,10230,จรเข้บัว,ลาดพร้าว,กรุงเทพมหานคร,ภาคกลาง
103801,10230,ลาดพร้าว,ลาดพร้าว,กรุงเทพมหานคร,ภาคกลาง
100508,10230,ท่าแร้ง,บางเขน,กรุงเทพมหานคร,ภาคกลาง
102701,10230,คลองกุ่ม,บึงกุ่ม,กรุงเทพมหานคร,ภาคกลาง
104402,10240,ราษฎร์พัฒนา,สะพานสูง,กรุงเทพมหานคร,ภาคกลาง
100601,10240,คลองจั่น,บางกะปิ,กรุงเทพมหานคร,ภาคกลาง
102704,10240,นวมินทร์,บึงกุ่ม,กรุงเทพมหานคร,ภาคกลาง
104401,10240,สะพานสูง,สะพานสูง,กรุงเทพมหานคร,ภาคกลาง
102701,10240,คลองกุ่ม,บึงกุ่ม,กรุงเทพมหานคร,ภาคกลาง
100608,10240,หัวหมาก,บางกะปิ,กรุงเทพมหานคร,ภาคกลาง
103402,10250,อ่อนนุช,สวนหลวง,กรุงเทพมหานคร,ภาคกลาง
104403,10250,ทับช้าง,สะพานสูง,กรุงเทพมหานคร,ภาคกลาง
103401,10250,สวนหลวง,สวนหลวง,กรุงเทพมหานคร,ภาคกลาง
103203,10250,ดอกไม้,ประเวศ,กรุงเทพมหานคร,ภาคกลาง
103202,10250,หนองบอน,ประเวศ,กรุงเทพมหานคร,ภาคกลาง
103201,10250,ประเวศ,ประเวศ,กรุงเทพมหานคร,ภาคกลาง
103403,10250,พัฒนาการ,สวนหลวง,กรุงเทพมหานคร,ภาคกลาง
104401,10250,สะพานสูง,สะพานสูง,กรุงเทพมหานคร,ภาคกลาง
100608,10250,หัวหมาก,บางกะปิ,กรุงเทพมหานคร,ภาคกลาง
100910,10260,พระโขนงใต้,พระโขนง,กรุงเทพมหานคร,ภาคกลาง
104703,10260,บางนาใต้,บางนา,กรุงเทพมหานคร,ภาคกลาง
104702,10260,บางนาเหนือ,บางนา,กรุงเทพมหานคร,ภาคกลาง
100905,10260,บางจาก,พระโขนง,กรุงเทพมหานคร,ภาคกลาง
103303,10260,พระโขนง,คลองเตย,กรุงเทพมหานคร,ภาคกลาง
103903,10260,พระโขนงเหนือ,วัฒนา,กรุงเทพมหานคร,ภาคกลาง
110111,10270,บางโปรง,เมืองสมุทรปราการ,สมุทรปราการ,ภาคกลาง
110113,10270,บางด้วน,เมืองสมุทรปราการ,สมุทรปราการ,ภาคกลาง
110114,10270,บางเมืองใหม่,เมืองสมุทรปราการ,สมุทรปราการ,ภาคกลาง
110115,10270,เทพารักษ์,เมืองสมุทรปราการ,สมุทรปราการ,ภาคกลาง
110103,10270,บางเมือง,เมืองสมุทรปราการ,สมุทรปราการ,ภาคกลาง
110102,10270,สำโรงเหนือ,เมืองสมุทรปราการ,สมุทรปราการ,ภาคกลาง
110101,10270,ปากน้ำ,เมืองสมุทรปราการ,สมุทรปราการ,ภาคกลาง
110117,10280,แพรกษาใหม่,เมืองสมุทรปราการ,สมุทรปราการ,ภาคกลาง
110104,10280,ท้ายบ้าน,เมืองสมุทรปราการ,สมุทรปราการ,ภาคกลาง
110108,10280,บางปูใหม่,เมืองสมุทรปราการ,สมุทรปราการ,ภาคกลาง
110110,10280,แพรกษา,เมืองสมุทรปราการ,สมุทรปราการ,ภาคกลาง
110116,10280,ท้ายบ้านใหม่,เมืองสมุทรปราการ,สมุทรปราการ,ภาคกลาง
110112,10280,บางปู,เมืองสมุทรปราการ,สมุทรปราการ,ภาคกลาง
110501,10290,นาเกลือ,พระสมุทรเจดีย์,สมุทรปราการ,ภาคกลาง
110502,10290,บ้านคลองสวน,พระสมุทรเจดีย์,สมุทรปราการ,ภาคกลาง
110503,10290,แหลมฟ้าผ่า,พระสมุทรเจดีย์,สมุทรปราการ,ภาคกลาง
110504,10290,ปากคลองบางปลากด,พระสมุทรเจดีย์,สมุทรปราการ,ภาคกลาง
110505,10290,ในคลองบางปลากด,พระสมุทรเจดีย์,สมุทรปราการ,ภาคกลาง
100206,10300,ถนนนครไชยศรี,ดุสิต,กรุงเทพมหานคร,ภาคกลาง
100204,10300,สี่แยกมหานาค,ดุสิต,กรุงเทพมหานคร,ภาคกลาง
100202,10300,วชิรพยาบาล,ดุสิต,กรุงเทพมหานคร,ภาคกลาง
100201,10300,ดุสิต,ดุสิต,กรุงเทพมหานคร,ภาคกลาง
100203,10300,สวนจิตรลดา,ดุสิต,กรุงเทพมหานคร,ภาคกลาง
100203,10303,สวนจิตรลดา,ดุสิต,กรุงเทพมหานคร,ภาคกลาง
101701,10310,ห้วยขวาง,ห้วยขวาง,กรุงเทพมหานคร,ภาคกลาง
101702,10310,บางกะปิ,ห้วยขวาง,กรุงเทพมหานคร,ภาคกลาง
101704,10310,สามเสนนอก,ห้วยขวาง,กรุงเทพมหานคร,ภาคกลาง
104504,10310,พลับพลา,วังทองหลาง,กรุงเทพมหานคร,ภาคกลาง
104503,10310,คลองเจ้าคุณสิงห์,วังทองหลาง,กรุงเทพมหานคร,ภาคกลาง
104502,10310,สะพานสอง,วังทองหลาง,กรุงเทพมหานคร,ภาคกลาง
104501,10310,วังทองหลาง,วังทองหลาง,กรุงเทพมหานคร,ภาคกลาง
100701,10330,รองเมือง,ปทุมวัน,กรุงเทพมหานคร,ภาคกลาง
100703,10330,ปทุมวัน,ปทุมวัน,กรุงเทพมหานคร,ภาคกลาง
100704,10330,ลุมพินี,ปทุมวัน,กรุงเทพมหานคร,ภาคกลาง
100702,10330,วังใหม่,ปทุมวัน,กรุงเทพมหานคร,ภาคกลาง
102601,10400,ดินแดง,ดินแดง,กรุงเทพมหานคร,ภาคกลาง
103704,10400,มักกะสัน,ราชเทวี,กรุงเทพมหานคร,ภาคกลาง
103703,10400,ถนนเพชรบุรี,ราชเทวี,กรุงเทพมหานคร,ภาคกลาง
103702,10400,ถนนพญาไท,ราชเทวี,กรุงเทพมหานคร,ภาคกลาง
103701,10400,ทุ่งพญาไท,ราชเทวี,กรุงเทพมหานคร,ภาคกลาง
102602,10400,รัชดาภิเษก,ดินแดง,กรุงเทพมหานคร,ภาคกลาง
101401,10400,สามเสนใน,พญาไท,กรุงเทพมหานคร,ภาคกลาง
101406,10400,พญาไท,พญาไท,กรุงเทพมหานคร,ภาคกลาง
100702,10400,วังใหม่,ปทุมวัน,กรุงเทพมหานคร,ภาคกลาง
100403,10500,สุริยวงศ์,บางรัก,กรุงเทพมหานคร,ภาคกลาง
100402,10500,สีลม,บางรัก,กรุงเทพมหานคร,ภาคกลาง
100404,10500,บางรัก,บางรัก,กรุงเทพมหานคร,ภาคกลาง
100405,10500,สี่พระยา,บางรัก,กรุงเทพมหานคร,ภาคกลาง
100401,10500,มหาพฤฒาราม,บางรัก,กรุงเทพมหานคร,ภาคกลาง
100702,10500,วังใหม่,ปทุมวัน,กรุงเทพมหานคร,ภาคกลาง
104604,10510,ทรายกองดิน,คลองสามวา,กรุงเทพมหานคร,ภาคกลาง
104603,10510,บางชัน,คลองสามวา,กรุงเทพมหานคร,ภาคกลาง
104605,10510,ทรายกองดินใต้,คลองสามวา,กรุงเทพมหานคร,ภาคกลาง
104602,10510,สามวาตะวันออก,คลองสามวา,กรุงเทพมหานคร,ภาคกลาง
104601,10510,สามวาตะวันตก,คลองสามวา,กรุงเทพมหานคร,ภาคกลาง
101001,10510,มีนบุรี,มีนบุรี,กรุงเทพมหานคร,ภาคกลาง
101002,10510,แสนแสบ,มีนบุรี,กรุงเทพมหานคร,ภาคกลาง
101105,10520,ทับยาว,ลาดกระบัง,กรุงเทพมหานคร,ภาคกลาง
101104,10520,ลำปลาทิว,ลาดกระบัง,กรุงเทพมหานคร,ภาคกลาง
101106,10520,ขุมทอง,ลาดกระบัง,กรุงเทพมหานคร,ภาคกลาง
101101,10520,ลาดกระบัง,ลาดกระบัง,กรุงเทพมหานคร,ภาคกลาง
101102,10520,คลองสองต้นนุ่น,ลาดกระบัง,กรุงเทพมหานคร,ภาคกลาง
101103,10520,คลองสามประเวศ,ลาดกระบัง,กรุงเทพมหานคร,ภาคกลาง
100307,10530,ลำผักชี,หนองจอก,กรุงเทพมหานคร,ภาคกลาง
100301,10530,กระทุ่มราย,หนองจอก,กรุงเทพมหานคร,ภาคกลาง
100302,10530,หนองจอก,หนองจอก,กรุงเทพมหานคร,ภาคกลาง
100303,10530,คลองสิบ,หนองจอก,กรุงเทพมหานคร,ภาคกลาง
100304,10530,คลองสิบสอง,หนองจอก,กรุงเทพมหานคร,ภาคกลาง
100305,10530,โคกแฝด,หนองจอก,กรุงเทพมหานคร,ภาคกลาง
100306,10530,คู้ฝั่งเหนือ,หนองจอก,กรุงเทพมหานคร,ภาคกลาง
100308,10530,ลำต้อยติ่ง,หนองจอก,กรุงเทพมหานคร,ภาคกลาง
110301,10540,บางพลีใหญ่,บางพลี,สมุทรปราการ,ภาคกลาง
110302,10540,บางแก้ว,บางพลี,สมุทรปราการ,ภาคกลาง
110308,10540,ราชาเทวะ,บางพลี,สมุทรปราการ,ภาคกลาง
110303,10540,บางปลา,บางพลี,สมุทรปราการ,ภาคกลาง
110304,10540,บางโฉลง,บางพลี,สมุทรปราการ,ภาคกลาง
110309,10540,หนองปรือ,บางพลี,สมุทรปราการ,ภาคกลาง
110205,10550,คลองด่าน,บางบ่อ,สมุทรปราการ,ภาคกลาง
110208,10560,คลองนิยมยาตรา,บางบ่อ,สมุทรปราการ,ภาคกลาง
110207,10560,เปร็ง,บางบ่อ,สมุทรปราการ,ภาคกลาง
110206,10560,คลองสวน,บางบ่อ,สมุทรปราการ,ภาคกลาง
